{"schema":"yearn.dao.feed.v2","chainId":1,"observedAt":1791417612,"block":{"number":"26060700","hash":"0x0b0c4c2a430fe1652cd8653abb004962e2779a61d692812b0fc5cbefb3fe3436","timestamp":1791417610},"deployments":[{"votingAddress":"0x543e8871562a8c53e8b6a26835aeecb3a5a13070","proposalCount":"1","configuration":{"voteStart":"604800","executeDelay":"0","executeGuard":true,"threshold":"5000","voter":"0x5069bce8c8e371a45ab113604b128bbdf5ee5c11","executor":"0xac7d4a37ba61c2cac7f64d3e2b5773d85613fe7b"}}],"proposals":[{"votingAddress":"0x543e8871562a8c53e8b6a26835aeecb3a5a13070","id":"0","proposer":"0xf39fd6e51aad88f6f4ce6ab8827279cfffb92266","epoch":"17","contentDigest":"0xa39c94b28720a40c5f1247f547a2c9d09278e3cfd9ae54cc0f52c20cad271891","scriptHash":"0x12e7e738438dfb13213ae69ae19b2f65c046cebf854209f9146aa6583ffb3c10","threshold":"5000","votes":"0","yea":"0","retracted":false,"executed":false,"flagged":false,"vetoed":false,"status":"VOTING","scriptBytes":"0xad7feeca9cf47e95d5a3644c4fdf5578b53491f00000000000000000000000242c16cd8a000000000000000000000000000000000000000000000000000000000000002a","contentBytes":"eyJzY2hlbWEiOiJ5ZWFybi5kYW8ucHJvcG9zYWwudjEiLCJtYXJrZG93biI6IiMgQnVpbHQgYXBwbGljYXRpb24gY2hlY2twb2ludFxuXG5WZXJpZnkgcHVibGljYXRpb24gYW5kIHRoZSByZWxlYXNlZCBwcm9kdWNlciBvbiB0aGUgbG9jYWwgZm9yay5cblxuIyMgRXhlY3V0aW9uXG5cblNldCB0aGUgZGlzcG9zYWJsZSBtYXJrZXIgdG8gNDIuXG4iLCJkaXNjdXNzaW9uVXJsIjoiaHR0cHM6Ly9nb3YueWVhcm4uZmkvdC9sb2NhbC1mb3JrLXVhdC8xMjM0IiwicHJvcG9zYWxUeXBlIjoiZXhlY3V0YWJsZSIsImNyZWF0ZWRCeSI6IjB4ZjM5RmQ2ZTUxYWFkODhGNkY0Y2U2YUI4ODI3Mjc5Y2ZmRmI5MjI2NiIsImNyZWF0ZWRBdCI6IjIwMjYtMDktMjZUMDk6MTk6NTMuMDAwWiIsImFzc2V0cyI6W119Cg==","events":[{"type":"propose","log":{"blockNumber":"26060697","blockHash":"0xdd4e9f74017e774e281684abb299d83c65948c40cd5922b76f5a55fd8ce985b3","timestamp":1790414460,"transactionHash":"0x0f17eaf04409d1d3f3619fbdcfaadc391d23a7d4f90de4d48a77d10aa5b9921e","transactionIndex":0,"logIndex":0}}]}]}