{"schema":"yearn.dao.feed.v2","chainId":1,"observedAt":1789570519,"block":{"number":"25990611","hash":"0x70c2bb58184b6e199ef93584c60cfaa21d80cba725a87f3a61c87a2755fc9795","timestamp":1789568635},"deployments":[{"votingAddress":"0x543e8871562a8c53e8b6a26835aeecb3a5a13070","proposalCount":"1","configuration":{"voteStart":"604800","executeDelay":"0","executeGuard":true,"threshold":"5000","voter":"0x5069bce8c8e371a45ab113604b128bbdf5ee5c11","executor":"0xac7d4a37ba61c2cac7f64d3e2b5773d85613fe7b"}}],"proposals":[{"votingAddress":"0x543e8871562a8c53e8b6a26835aeecb3a5a13070","id":"0","proposer":"0xf39fd6e51aad88f6f4ce6ab8827279cfffb92266","epoch":"16","contentDigest":"0x71ef88a77e301d47957b438c72aa010773908caa1a85dfe88aadd863dcd57add","scriptHash":"0xd420ae33c96e4fff85b5c491e82e119632ca750438898f348963ccf4d3d2fe79","threshold":"5000","votes":"0","yea":"0","retracted":false,"executed":false,"flagged":false,"vetoed":false,"status":"PROPOSED","scriptBytes":"0xc5dfba72687ce3fc36d1033dc9056b0027235d590000000000000000000000242c16cd8a000000000000000000000000000000000000000000000000000000000000002a","contentBytes":"eyJzY2hlbWEiOiJ5ZWFybi5kYW8ucHJvcG9zYWwudjEiLCJtYXJrZG93biI6IiMgTG9jYWwgZXhlY3V0aW9uIFVBVFxuXG5WZXJpZnkgdGhlIGRlcGxveWVkIGdvdmVybmFuY2UgY29udHJhY3RzIG9uIGEgZGlzcG9zYWJsZSBmb3JrLlxuXG4jIyBFeGVjdXRpb25cblxuU2V0IHRoZSBsb2NhbCBtYXJrZXIgdG8gNDIuXG4iLCJkaXNjdXNzaW9uVXJsIjoiaHR0cHM6Ly9nb3YueWVhcm4uZmkvdC9sb2NhbC1mb3JrLXVhdC8xMjM0IiwicHJvcG9zYWxUeXBlIjoiZXhlY3V0YWJsZSIsImNyZWF0ZWRCeSI6IjB4ZjM5RmQ2ZTUxYWFkODhGNkY0Y2U2YUI4ODI3Mjc5Y2ZmRmI5MjI2NiIsImNyZWF0ZWRBdCI6IjIwMjYtMDktMTZUMTQ6MjM6MjcuMDAwWiIsImFzc2V0cyI6W119Cg==","events":[{"type":"propose","log":{"blockNumber":"25990611","blockHash":"0x70c2bb58184b6e199ef93584c60cfaa21d80cba725a87f3a61c87a2755fc9795","timestamp":1789568635,"transactionHash":"0xd830a8ca032180d3f3d4dcaa107441d41cb32e41bd22eea8201139b1638475bd","transactionIndex":0,"logIndex":0}}]}]}