{"schema":"yearn.dao.feed.v2","chainId":1,"observedAt":1789055160,"block":{"number":"25947819","hash":"0x4800fff0b9df140dd427072d58939aead3e4c0ab8bb970a3954afe1fd2eb9315","timestamp":1789053842},"deployments":[{"votingAddress":"0x543e8871562a8c53e8b6a26835aeecb3a5a13070","proposalCount":"1","configuration":{"voteStart":"604800","executeDelay":"0","executeGuard":true,"threshold":"5000","voter":"0x5069bce8c8e371a45ab113604b128bbdf5ee5c11","executor":"0xac7d4a37ba61c2cac7f64d3e2b5773d85613fe7b"}}],"proposals":[{"votingAddress":"0x543e8871562a8c53e8b6a26835aeecb3a5a13070","id":"0","proposer":"0xf39fd6e51aad88f6f4ce6ab8827279cfffb92266","epoch":"16","contentDigest":"0xd21560070a62c4fb3b6683bff6ff9dc8a33d041511d29ee632619c66bb142de0","scriptHash":"0x0f575f8648572b3856770fc672ffee7dcefc8943a70df0bf2f740023aa6e0b99","threshold":"5000","votes":"0","yea":"0","retracted":false,"executed":false,"flagged":false,"vetoed":false,"status":"PROPOSED","scriptBytes":"0xcc452c6ce5c0c52ac6e4dfade614d156ff2330bd0000000000000000000000242c16cd8a000000000000000000000000000000000000000000000000000000000000002a","contentBytes":null,"events":[{"type":"propose","log":{"blockNumber":"25947819","blockHash":"0x4800fff0b9df140dd427072d58939aead3e4c0ab8bb970a3954afe1fd2eb9315","timestamp":1789053842,"transactionHash":"0x824d0fbb1850c0cd330321a7d8e746afc757027c8bad3d8323aa3a3d64ec44f6","transactionIndex":0,"logIndex":0}}]}]}